{"attempt_statuses":["warmup-passed","valid-success","valid-expected-rejection","infrastructure-invalid"],"evidence_profile_id":"LOCUS-managed-performance-evidence-profile-v1","format_id":"LOCUS-managed-performance-scenario-manifest-v1","invalid_categories":["build-failure","startup-failure","health-check-failure","host-interruption","orchestrator-failure","provider-unavailable-outside-schedule","measurement-integrity-failure","cleanup-failure"],"measured_slot_count":1180,"methodology_id":"LOCUS-managed-performance-methodology-v1","methodology_sha256":"3996e7a8b8c974e2e551a1717ad57454456143528733f6d5a8a182a1a2f8379c","scenario_slot_counts":{"MP00":40,"MP01":120,"MP02":120,"MP03":120,"MP04":120,"MP05":120,"MP06":120,"MP07":40,"MP08":40,"MP09":40,"MP10":40,"MP11":40,"MP12":80,"MP13":120,"MP14":10,"MP15":10,"MP16":10,"MP17":10,"MP18":10,"MP19":10},"scenarios":{"MP00":{"category":"warmup","measured":false,"name":"warmup"},"MP01":{"category":"central","measured":true,"name":"enrollment"},"MP02":{"category":"central","measured":true,"name":"package-export-import"},"MP03":{"category":"central","measured":true,"name":"clean-client-bootstrap"},"MP04":{"category":"central","measured":true,"name":"successful-recovery"},"MP05":{"category":"central","measured":true,"name":"wrong-input-rejection"},"MP06":{"category":"central","measured":true,"name":"one-party-unavailable-recovery"},"MP07":{"category":"structural","measured":true,"name":"below-threshold-rejection"},"MP08":{"category":"structural","measured":true,"name":"party-restart-recovery"},"MP09":{"category":"structural","measured":true,"name":"client-restart-reimport-recovery"},"MP10":{"category":"structural","measured":true,"name":"preserved-system-restart"},"MP11":{"category":"structural","measured":true,"name":"storage-and-role-snapshot"},"MP12":{"category":"successor","measured":true,"name":"successor-transition"},"MP13":{"category":"concurrency","measured":true,"name":"concurrent-successful-recovery"},"MP14":{"category":"lifecycle","measured":true,"name":"manager-system-startup"},"MP15":{"category":"lifecycle","measured":true,"name":"client-create"},"MP16":{"category":"lifecycle","measured":true,"name":"client-stop"},"MP17":{"category":"lifecycle","measured":true,"name":"client-start"},"MP18":{"category":"lifecycle","measured":true,"name":"client-restart"},"MP19":{"category":"lifecycle","measured":true,"name":"client-destroy"}},"scheduled_slot_count":1220,"slot_digest":"98192968ffffd525124a64758ebd7e640de14af1054a7e536146ffd4a9aea1f9","status":"assigned"}
